cluster_id,theme_title,audience,rationale,phrase_count
0,Service Level Agreement Management,All,"Understanding and managing SLA compliance is critical for maintaining customer trust, avoiding penalties, and ensuring business continuity.",6
1,Quality Assurance Process,All,"This theme matters to all stakeholders as it ensures the quality and reliability of our software, impacting customer satisfaction and business reputation.",9
2,Competitive Market Positioning,All,Understanding the competitive landscape is crucial for informed business decisions and strategic growth.,9
3,Cloud and Integration Configuration,Engineering,This theme matters to the engineering team because it highlights their responsibility in ensuring seamless integration and configuration of various cloud services and security protocols.,23
4,Healthcare Data Security,All,"Ensuring the integrity and accuracy of healthcare data is crucial for patient care, regulatory compliance, and business reputation.",6
5,Multi-Factor Authentication Management,Engineering,Effective MFA management is crucial for our engineering team to ensure seamless user experiences and robust security controls.,7
6,Customer Renewal and Retention,All,Understanding customer retention and renewal risks is crucial for maintaining revenue stability and growth across the organization.,11
7,Escalation Process and Management,All,"Understanding escalation procedures is crucial for ensuring timely issue resolution, maintaining customer satisfaction, and optimizing support operations across the organization.",5
8,Incident Response and Review,All,"Effective incident response and review processes are critical for maintaining customer trust, minimizing downtime, and ensuring business continuity.",18
9,Outage Prevention and Recovery,Engineering,"Effective outage remediation is crucial for maintaining customer trust and ensuring business continuity, making it a top priority for the engineering team.",13
10,HIPAA Compliance and Reporting,All,"Compliance with HIPAA regulations is a critical concern for our customers, and effective reporting is essential for meeting these requirements.",7
11,Compliance and Governance,All,"Effective compliance management is critical for maintaining customer trust, avoiding regulatory penalties, and ensuring the long-term viability of our business.",24
12,Audit Readiness and Compliance,All,Ensuring timely completion of SOC 2 audits is critical for maintaining customer trust and meeting regulatory requirements.,9
13,Billing and Pricing Issues,Sales | Customer Support,"This theme matters to the sales team because they need to address customer concerns about billing and pricing, while also ensuring accurate revenue recognition.",11
14,Data Backup and Recovery,All,"Effective data backup and recovery strategies are critical for business continuity, customer trust, and revenue protection.",23
15,Identity and Access Security,All,"Effective identity management is critical for maintaining data security, compliance, and user experience across the organization.",24
16,Compliance and Roadmap Planning,All,Understanding the company's compliance requirements and roadmap planning is crucial for leadership to ensure strategic alignment and risk mitigation across all teams.,7
17,Upselling and Cross-Selling Strategy,Sales,"Effective sales alignment is crucial for identifying and capitalizing on upsell and cross-sell opportunities, driving revenue growth.",8
18,Product and Feature Development,All,"This theme is critical for the leadership team as it encompasses various aspects of product growth, maintenance, and customer satisfaction.",37
19,Alert and Security Management,All,"Effective alert management is critical for security, reliability, and customer adoption of our SaaS platform.",19
20,Customer Onboarding and Support,All,"Effective onboarding and support processes are critical for customer satisfaction, retention, and ultimately revenue growth.",8
21,IT Operations and Planning,Engineering,"Effective IT operations planning enables efficient deployment, reduces downtime, and ensures compliance, directly impacting the engineering team's productivity and service quality.",14
22,Product Maturity Gaps,All,Understanding these gaps is crucial for leadership to prioritize product development and resource allocation.,6
23,Infrastructure Architecture Challenges,Engineering | Product,"This theme matters to Engineering and Product teams because it highlights the need for effective infrastructure architecture planning to support scalability, performance, and hybrid environments.",11
24,System Reliability and Support,All,"Effective system reliability and support directly impact customer satisfaction, business continuity, and revenue.",16
25,Platform Reliability and Resilience,All,Ensuring the reliability of our platform is critical to maintaining customer trust and driving business growth.,12
